<?xml version="1.0" encoding="UTF-8"?>
<wzdx_road_events_feed xmlns:xsi="http://www.w3.org/2001/XMLSchema-instance" xsi:noNamespaceSchemaLocation="xml-schema.xsd">
	<road_event_feed_info>
		<feed_info_id>ID</feed_info_id>
		<feed_update_date>2016-04-12T00:01:00</feed_update_date>
		<metadata>URL</metadata>
		<version>2.0</version>
	</road_event_feed_info>
  <road_events>
    <road_event>
  		<road_event_id>ID</road_event_id>
  		<feed_info_id>ID</feed_info_id>
  		<subidentifier>ID</event_subidentifier>
  		<geometry_type>MultiPoint</geometry_type>
  		<geometry>[[40.635122,-122.733841],[40.67201,-122.654384]]</geometry>
  		<road_name>Text</road_name>
  		<road_number>Text</road_number>
  		<direction>eastbound</direction>
  		<beginning_cross_street>Text</beginning_cross_street>
  		<ending_cross_street>Text</ending_cross_street>
  		<beginning_milepost>1.5</beginning_milepost>
  		<ending_milepost>2.5</ending_milepost>
  		<beginning_accuracy>estimated</beginning_accuracy>
  		<ending_accuracy>estimated</ending_accuracy>
  		<start_date>2016-11-03T19:37:00</start_date>
  		<end_date>2016-11-04T05:30:00</end_date>
  		<start_date_accuracy>estimated</start_date_accuracy>
  		<end_date_accuracy>estimated</end_date_accuracy>
  		<event_status>planned</event_status>
  		<total_num_lanes>2</total_num_lanes>
  		<open_lanes>right-lane</open_lanes>
  		<closed_lanes>left-lane</closed_lanes>
  		<closed_shoulders>inside</closed_shoulders>
  		<workers_present>true</workers_present>
  		<reduced_speed_limit>20</reduced_speed_limit>
  		<restrictions>
        <restriction>no-trucks</restriction>
      </restrictions>
  		<description>Text</description>
  		<issuing_organization>Text</issuing_organization>
  		<creation_date>2016-04-12T00:01:00</creation_date>
  		<update_date>2016-04-12T00:01:00</update_date>
  	</road_event>
  </road_events>
</WZDx>
